Text,Error Type
"Israel s transportation minister is pushing ahead with a plan to extend Jerusalem s soon-to-open high-speed rail line to the Western Wall, where he wants to name a future station after President Donald Trump. The Western Wall is the holiest place for the Jewish people, and I decided to name the train station that leads to it after president Trump   following his historic and brave decision to recognize Jerusalem as the capital of the State of Israel,  Transportation Minister Yisrael Katz told the Jerusalem Post.The national daily newspaper Yedioth Ahronoth was first to report Tuesday that Katz had approved final construction plans for the train, which will include excavating a 2-mile tunnel from the Umma (nation) station at the entrance to the city to the Cardo in the Jewish Quarter.The route will take travelers through downtown Jerusalem and under the politically and historically sensitive Old City. The Western Wall is the holiest site where Jews can pray.Transportation Ministry spokesman Avner Ovadia said Wednesday the project is estimated to cost more than $700 million and, if approved, would take four years to complete.Katz s office said in a statement that the minister advanced the plan in a recent meeting with Israel Railways executives, and has fast-tracked it in the planning committees.Katz said a high-speed rail station would allow visitors to reach  the beating heart of the Jewish people   the Western Wall and the Temple Mount. Donald Trump: It s time to recognize Jerusalem as Israel s capital.Trump s announcement acknowledging Jerusalem as Israel s capital   and his pledge to move America s embassy there   enraged Palestinians and much of the Muslim world.The United Nations General Assembly adopted a resolution last week rejecting the U.S. s recognition of Jerusalem as Israel s capital, with several traditional American allies voting in favor of the motion.The Western Wall train proposal will likely face opposition from the international community, which doesn t recognize Israeli sovereignty over east Jerusalem and the Old City, which Israel captured in the 1967 Mideast war and later annexed. ThePalestinians seek east Jerusalem and the Old City, home to Muslim, Christian and Jewish holy sites, as capital of a future state.  Daily Mail ",False Positive
"Legal expert and Constitutional law professor Jonathan Turley makes a case for why we need to ADD to statues and not take them down. He says we can learn more from keeping them up in direct opposition to what Democrats are saying:TURLEY RECENTLY ARGUED AGAINST THE REMOVAL OF THE GEORGE WASHINGTON STATUE: George Washington may have survived the winter at Valley Forge, but he may not see the end of the summer of Charlottesville. Bishop James Dukes of Chicago s Liberation Christian Center and others are calling for the removal of his and Andrew Jackson s statues and and stripping of their names from parks. Dukes insists that these monuments are  a slap in the face and it s a disgrace  for African Americans given their history as slave owning presidents.The bishop s call for the removal of our first president s statue is the latest effort to strip away the names of historical figures over ties to slavery or segregation. There is a movement to remove the name of Woodrow Wilson (who helped establish Princeton as a world academic institution) from buildings and schools, due to his support for segregation. The University of Virginia was founded by Thomas Jefferson, but last year, University President Teresa Sullivan was denounced by students and faculty for merely quoting our third president in a public message because he was a slave owner.The call to remove Washington s statue came less than a day after President Trump asked whether Washington would be next in the movement to remove statues like the Robert E. Lee monument in Charlottesville. The statement drew the ire of CNN s Jim Acosta who described the notion as absurd and said it was  taken as a sign that the president perhaps needs a refresher course and needs to go back to History 101.  History is precisely where this controversy should begin and end. Washington is rightfully condemned for his ownership of slaves. There were contemporaries like John Adams, John Jay, Benjamin Franklin and Alexander Hamilton who were outspoken critics of slavery. Franklin called slavery  an atrocious debasement of human nature,  while Adams referred to it as a  foul contagion in the human character.  These visionaries not only saw a great evil but answered the call of history to stand steadfastly against it.However, before Mayor Rahm Emanuel sends in the bulldozers into Washington Park, it is worth considering a few facts about our first president s history with slavery. Washington inherited a number of slaves at age 11 and received more slaves in his marriage to Martha Custis. However, he gradually came to oppose slavery. On the interim, Washington tried to assuage his guilt by refusing to sell slaves that would break up families, telling an associate that it was  against my inclination to hurt the feelings of those unhappy people by a separation of man and wife, or of families. After the war, Washington continued to discuss ways to convert his plantation from slaves to tenants at the suggestion of his close aide (and outspoken opponent of slavery) Marquis de Lafayette. By 1786, Washington wrote his friend Robert Morris,  I can only say that there is not a man living who wishes more sincerely than I do, to see a plan adopted for the abolition of [slavery]. In the end, Washington was the only one of nine slaveholding presidents (and the only slaveholding founder) who freed his slaves upon his death. Washington freed as many of his 317 slaves as possible. Some 123 slaves were his to emancipate while neither he nor Martha could free the so-called  Custis Dower slaves  (who remained property of the heirs to the estate of Daniel Parke Custis, Martha Washington s first husband). He further ordered that all of the elderly or sick slaves would be supported by his estate for the rest of their lives.So where does this leave us? With a complex and flawed figure who practiced a great evil while belatedly coming to reject it. He finished his life allied with his more enlightened colleagues but this is no reason to forgive his prior history. However, that is the point of history. It is never some neat narrative divided cleanly between demons and angels. Washington was a great leader who held a nation together through sheer leadership and stands as one of the few leaders in history to refuse to become a monarch himself.Curiously, Dukes does offer a concession. Washington Park and Jackson Park could be formally named after former Mayor Harold Washington and civil rights leader Rev. Jesse Jackson or singer Michael Jackson. It is unlikely to convince those who view these statutes as not simply reminders of past leaders but past struggles in an evolving society. The same cannot be said for Michael Jackson.  Thriller  may be the best selling album in history, but the Battle of New Orleans still has more of a hold on history.The fact is that we often learn as much from the failures as we do the triumphs of historical figures. Washington ultimately proved to be an early transitional figure in our ugly history of slavery. Washington himself described his desire at Mount Vernon  to lay a foundation  for a  rising generation  with a  new destiny  other than slavery.For my part, I am proud to teach at the George Washington University, whose charter was paid for by Washington himself as part of that same final testament. Of course, that does not mean we could not make other improvements. Another school in Washington is named after a British king, George II, who kept our nation under colonial oppression. After all, the moonwalk and robot dance steps did have a transformative impact on my generation  and  Jacksontown University  has a nice ring to it.Jonathan Turley is the Shapiro Professor of Public Interest Law at George Washington University. You can follow him on Twitter @JonathanTurley.READ MORE: THE HILL",False Positive
"President Donald Trump welcomed India s Prime Minister Narendra Modi to the White House Monday for their first meeting, as the U.S. branded a top militant from neighboring Pakistan as a  global terrorist. The leaders of the world s two largest democracies are looking to expand ties on defense and fighting terrorism, but strains are likely on trade. Their personal chemistry could prove as important as policy in setting the tone for relations.During brief Oval Office remarks, Trump heaped praise on Modi as a  great prime minister  who had brought economic growth to India. Modi recalled Trump s visits to India long before he was president and said he was looking forward to collaborating with him now that he is president. The relationship between the United States and India is very, very strong and very, very powerful,  Trump said.  We agree on most things. And I would say, by the end of the day we ll agree on everything. I have a feeling,  he joked.Meanwhile back in India, a village is so enamored with President Trump that they ve renamed their village after him: #News: As @POTUS @realDonaldTrump's popularity soars abroad, a village in #India renames itself ""Trump"" to honour their American hero.   pic.twitter.com/3ogNWWcwMA   l g s  (@Maximus_4EVR) June 27, 2017Hours before Modi s arrival, the State Department imposed sanctions on Syed Salahuddin, the Pakistan-based leader of Hizbul Mujahideen, the main rebel group that fights against Indian control in the divided Himalayan region of Kashmir. India s foreign ministry hailed the move.Trump s press conference with India s Prime Minister:Trump has so far focused on outreach to China, India s strategic rival, as he looks to Beijing to rein in nuclear-armed North Korea. But Washington and New Delhi share concerns about China s rise as a military power that has underpinned increasingly close relations in the past decade.  PBS",False Positive
