Text,Error Type
"The U.S. Government spends $22 billion a year to fight the global warming crisis (twice as much as it spends protecting our border). To put that in perspective, that is $41,856 every minute going to global warming initiatives. But that s just the tip of a gargantuan iceberg. According to Forbes columnist Larry Bell, the ripple effect of global warming initiatives actually costs Americans $1.75 trillion . . . every year. The United Nations is not a friend of democracy, it s not a friend to freedom, it s not a friend even to the United States of America,  Trump said during a speech in March to the American Israel Public Affairs Committee.The election of Donald Trump as the next U.S. president was met with disbelief and despondency on Wednesday among some United Nations officials and diplomats amid uncertainty surrounding his foreign policy and likely engagement with the world body.Trump, a Republican, has described the 71-year-old United Nations as weak and incompetent and threatened to pull out of a global deal to combat climate change   a cornerstone of the legacy of U.N. chief Ban Ki-moon, who steps down at the end of 2016 after serving two five-year terms as secretary-general. The United Nations is not a friend of democracy, it s not a friend to freedom, it s not a friend even to the United States of America,  Trump said during a speech in March to the American Israel Public Affairs Committee.The United States is a veto-wielding member of the 15-member U.N. Security Council and the largest financial contributor to the United Nations. Washington owes about $1.1 billion, the United Nations said. Republicans have long been reluctant to pay dues, accusing the world body of waste and bias.Ban said on Wednesday he hoped that the Trump administration would  strengthen the bonds of international cooperation. People everywhere look to the United States to use its remarkable power to help lift humanity up and to work for the common good,  Ban told reporters.Topping the United Nations agenda are conflicts in Syria, Yemen, South Sudan, Iraq and elsewhere, and a refugee and migrant crisis that saw a record 65.3 million people uprooted worldwide last year. More than ever, we need an America that is committed to world affairs, including at the United Nations,  French U.N. Ambassador Francois Delattre said.A senior Security Council diplomat, speaking on condition of anonymity, said Trump s foreign policy had so far  not been very coherent  and his victory did not bode well for the future effectiveness of the council. The assumption is that (a Trump administration) will be less engaged with U.N. than (President Barack) Obama s administration, which was more committed to working for collective solutions than previous U.S. administrations,  the diplomat said.Several U.N. diplomats noted a lack clarity from Trump on foreign policy. We have not really heard a very clear indication of where he is going,  Iraq s U.N. Ambassador Mohamed Ali Alhakim told reporters on Wednesday, adding that he believed the United Nations would remain relevant.The United Nations High Commissioner for Human Rights, Zeid Ra ad al Hussein, last month warned that the world would be in danger if Trump was elected president. Zeid would continue to call out any Trump policies or practices that undermine or violate human rights, his spokesman said.Via: Reuters",False Positive
"Washington (Reuters) - Banks were regrouping on Thursday, a day after being handed a large defeat in the U.S. House, where Republicans sided with retailers in agreeing to preserve limits on debit card fees. The financial industry insisted it was not done fighting to remove limits on the fees. Retailers were already looking to carry the fight to credit card fees. “We are glad this fight is over, and are happy with our victory,” said Austen Jensen with the Retail Industry Leaders Association. “The banks should clearly know that this is over with.” “This debate is not over,” said Rob Nichols, president and CEO of the American Bankers Association. The House had been considering a broad financial reform bill that included a repeal of the Durbin amendment, which established the limits on debit card fees. The limits were backed by Senator Dick Durbin of Illinois when the Dodd-Frank financial reform law was enacted in 2010. The effort to remove the card fee limits had drawn strong opposition in the House. Representative Jeb Hensarling, the bill’s author, announced Wednesday he would end the effort to eliminate the Durbin amendment because he did not want to see his entire finance bill upended. “I’ve said before that repeal of the Durbin amendment was the most contentious part of the bill among Republicans,” he said in a statement. “We won’t let this one provision hinder passage of an important priority bill.” The full House is expected to vote on Hensarling’s bill in the coming weeks, but there is enough opposition in the Senate that it will probably not become law. The feud over government caps on the fees retailers pay when accepting debit cards has run red hot ever since the limits were imposed. With billions of dollars in revenue at stake, banks and retailers have battled nearly constantly in Washington. Retailers have argued the cap is critical to control sky-high costs imposed by a handful of card servicers, while banks insist the limit represents government meddling in private industry. Nichols said limiting debit card fees was “wrong and Congress should fix it.” Under Dodd-Frank, the Federal Reserve was ordered to set limits on how much Visa and Mastercard could charge for processing debit card transactions. The end result nearly halved fees received by banks, dropping the cost of a debit card transaction from an average of 45 cents to an average of 24 cents. ",False Negative
"GOP leaders have unleashed a stunning level of vitriol against their party’s most successful presidential candidate.  House Speaker Paul Ryan (R-Wis.), emphatically declared last week that he was not ready to endorse Donald Trump, his party’s presumptive presidential nominee. This move was unprecedented in modern American history. Trump’s response was that Ryan may need to be replaced as head of the Republican National Convention.  Ryan’s rebuke reminds Americans that Trump is deeply unpopular, particularly among a significant number of powerful Republicans. Former GOP presidential nominee Mitt Romney belittled the GOP’s new leader as a moral cretin unfit to be the standard bearer. Former President George W. Bush and his father, President George H.W. Bush, both say they are not attending the GOP convention in Cleveland.  Such attacks, however, are nothing new.  Political elders have lambasted their party’s leading presidential contenders throughout U.S. history. The big difference now is that this battle is playing out in public. In the past, attacks were largely in party backrooms, behind closed doors.  To be sure, some serious breaks have been acted out in public. With dire results. President Theodore Roosevelt, for example, realized in 1912 that his progressive agenda was being abandoned by his chosen successor, William Howard Taft. TR challenged Taft in the Republican primaries. “We stand at Armageddon,” Roosevelt thundered at the convention, “and we battle for the Lord!”  When Taft prevailed, Roosevelt bolted the party. He ran as a third-party candidate in 1912 on a Progressive Party ticket. Ultimately, the Democratic nominee, Woodrow Wilson, won.  In most other cases, however, the internecine bloodletting took place in private, preserving the appearance of party unity and making it easier to heal any rifts.  The 1944 Republican nominee Thomas Dewey ignored former President Herbert Hoover at an important state funeral that October and drew the national leader’s ire. “Dewey has no inner reservoir of knowledge on which to draw for his thinking.” Hoover sneered to a friend. “A man couldn’t wear a mustache like that without having it affect his mind.”  Hoover, though, sought to keep his beliefs private  Former presidents have kept mum even when they see a nominee as a threat to their legacy. In 1964, for example, former President Dwight D. Eisenhower didn’t have much regard for Senator Barry Goldwater. The conservative firebrand had repudiated Eisenhower’s presidency as a “dime-store New Deal.” Nonetheless, Eisenhower gave only halting support to the party’s anti-Goldwater forces. Despite Eisenhower’s contempt, the Arizonan became the Republican nominee, only to lose in a landslide to President Lyndon B. Johnson.  Four years earlier, the Democratic power brokers were not as reticent. They viewed Senator John F. Kennedy, their party’s leading candidate in 1960, as too conservative and inexperienced. They disliked the campaign role of Joseph Kennedy, JFK’s father, and his controversial past. In addition, party leaders worried that JFK could not win national office because he was a Catholic.  During the primaries, Truman, the titular head of the party, told a TV news conference that a nominee should have “the greatest possible maturity and experience” -- a clear dig at JFK’s relative youth. The former president beseeched his party to hold a brokered convention and find a way to avoid nominating Kennedy. Eventually, however, Truman endorsed Kennedy in the general election, reasoning that GOP nominee Richard M. Nixon was worse  Adlai Stevenson, the Democratic nominee in 1952 and 1956, also refused to back Kennedy during the primary. Even Kennedy’s promise to name Stevenson as secretary of state could not persuade him.  Still, most of the party elders’ scathing criticism against JFK was confined to backroom conversations. Senate Majority Leader Lyndon B. Johnson, who also wanted the nomination, privately mocked Kennedy as “a scrawny little fellow with rickets.” Johnson urged Eisenhower to oppose Kennedy during the primary contest, calling him “a [Senate] nobody” and “a dangerous man.”  But Johnson’s efforts to stop Kennedy were not aired before the country in real time. In fact, 1960 demonstrated how the Democratic elders were able to prevent serious rifts from destroying their party’s chances. After securing the nomination, JFK offered — and LBJ accepted — the second slot on the ticket.  The resentment of party elders toward party nominees was often rooted in a sense that the candidate was repudiating a mentor’s record. In the 1960 GOP presidential race, for example, Eisenhower resented Vice President Nixon’s implication that he would offer more robust leadership. Close to Election Day, Ike was asked to name an instance when Nixon’s advice influenced a presidential decision. “If you give me a week,” Eisenhower replied, “I might think of one.”  In the reverse situation, Vice President Al Gore sought to distance himself from President Bill Clinton during the 2000 presidential campaign. Gore declared in his announcement that he would provide “moral leadership” and defend the American family — not-so-subtle knocks against Clinton’s sexual relationship with a White House intern, Monica Lewinsky. The bitterness between the two men festered and Gore never asked Clinton to campaign with him. After Gore lost to George W. Bush, Clinton upbraided his former vice president for running a lame, visionless campaign.  The current spectacle — in which former Senator Bob Dole will likely be the only past Republican presidential nominee to come to the convention and endorse the party’s standard bearer — is partly a function of Trump’s scorched-earth multi-media campaign. His attacks have been leveled personally, in real-time, via Twitter and cable news. Wounds are deeper, and could be harder to heal.  Trump’s presidential primary campaign is the apotheosis of the anti-Washington mood that has gripped presidential politics since Jimmy Carter’s 1976 White House run. One reason Trump vanquished his foes was because he ran against the GOP’s leadership as out-of-touch and inept.  This played out even as party elders have less power to shape national tickets — and outsiders more ability to tear down anything that smacks of Washington politics-as-usual.  Republican-on-Republican hits on Trump and his main rival, Ted Cruz, have contributed to the fraying of the GOP. The anti-Trump former presidents, as well as current and former party chairmen and congressional leaders, have much at stake. They are fighting for, as they see it, their legacies, their party’s future, their professional identities — and their own power.  In recent decades, party elders have been clinging to an increasingly tenuous position. Think former Majority Leader Eric Cantor, who lost a primary election, as Sarah Palin recently noted. Or former House Speaker John Boehner, who was unable to control his party’s Tea Party wing. Boehner is still so incensed that he called Senator Ted Cruz (R-Tex.) “Lucifer in the flesh.” As we are seeing now with Ryan, Trump’s ferocious public attacks could yet come back to haunt him. Unlike so many past presidential primaries, this rift might prove irreparable.  ",False Negative
"WASHINGTON (Reuters) - Warships from eight NATO countries participated in live-fire self-defense exercises of ship and missile systems near Scotland on Sunday the U.S. Department of Defense said. Ships from Canada, France, Germany, Italy, the Netherlands, Spain, the United Kingdom and the United States defended against a medium-range missile as well as three anti-ship cruise missiles. The USS Donald Cook successfully intercepted a medium-range missile with a Standard Missile-3 Block IB guided missile during the exercise, the Pentagon said.  Three anti-ship cruise missiles were fired upon by Spanish and Dutch ships participating in the  Formidable Shield  exercises in the U.K. Ministry of Defense s Hebrides Range located on the Western Isles of Scotland.  The U.S. Department of Defense said this was the first time NATO s  smart defense  concept was demonstrated with some ships providing protection to other vessels targeting ballistic missiles. The Formidable Shield exercise began on Sept. 24 and is scheduled to conclude on Wednesday. The Pentagon said the exercise is planned to be a biennial event and is designed to assure allies, deter adversaries and demonstrate U.S. commitment to collective defense of the NATO alliance. Following the NATO exercises, the U.S. Missile Defense Agency successfully test-fired a Standard Missile-6 (SM-6) from the USS McFaul. The SM-6 test was not part of the Formidable Shield exercise, the Pentagon said. ",False Negative
"MOSCOW (Reuters) - Russian President Vladimir Putin joked on Thursday that if former FBI director James Comey suffers persecution because of his falling-out with U.S. President Donald Trump, Russia is ready to grant him asylum. The offer, made with Putin’s trademark sardonic humor, came as the Russian president poured scorn on Comey for his role in a row in Washington over alleged Russian meddling in last year’s U.S. presidential election. At a congressional hearing this month, Comey said Trump asked him to drop an investigation into contacts between Trump associates and Russian officials, while the U.S. president has accused Comey of not telling the truth. Asked about Comey at a question-and-answer session with Russian voters, Putin said it was “strange” that, while still FBI director, Comey had passed the contents of a conversation he had with Trump to the media via a friend. “What is the difference then between the FBI director and Mr. Snowden?” Putin said, referring to former U.S. National Security Agency contractor Edward Snowden, who was granted asylum in Russia in 2013 after leaking classified information about U.S. spy operations. “In this case, he (Comey) is not the head of a special service but a human rights activist who defends a certain position,” Putin said. “By the way, if he is subject to any sort of persecution in connection with this, we will be ready to give him political asylum in Russia. And he should know about this.” Striking a more serious note, Putin said Comey, in his congressional testimony, had produced no proof that Russia had meddled in the U.S. election. “I am not familiar in detail with the testimony given by former FBI director Comey,” Putin said. “Again, he gave no evidence of this (Russian interference).” “And what about constant U.S. propaganda, constant U.S. support of America-oriented non-governmental organizations by giving them money directly? Isn’t it an impact on our minds? Isn’t it an attempt to influence how we should behave during election campaigns? This continues year after year,” he said. Putin said many heads of state around the world had told him of similar U.S. meddling in their internal affairs. But they would not voice their concerns openly, fearing they would “spoil relations” with Washington, he said.  As for Russia, “we have an opinion of our own, we express it openly. But this is not any sort of underground, subversive activity”, Putin said. ",False Negative
"NEW YORK (Reuters) - Former New York State Assembly Speaker Sheldon Silver, for decades one of the state’s most powerful politicians, was sentenced on Tuesday to 12 years in federal prison for collecting millions of dollars in illegal kickbacks. U.S. District Judge Valerie Caproni in Manhattan federal court said she hoped the penalty would cause “the next corrupt politician to hesitate” before accepting a bribe. The prison term could amount to a life sentence for the 72-year-old Silver, who fought prostate cancer last year. The sentencing capped a stunning fall from power for Silver, a Democrat who represented Manhattan’s Lower East Side and served as speaker of the state Assembly from 1994 to 2015. Silver’s counterpart in the state Senate, former Majority Leader Dean Skelos, was also found guilty of corruption just 10 days after a jury convicted Silver of seven counts in December. The legislative leaders were two of the “three men in a room,” along with the governor, who control virtually all legislation in the state capital of Albany. Their convictions represented the biggest wins in a broad anti-corruption campaign by Preet Bharara, the U.S. Attorney in Manhattan, who has charged numerous politicians with graft. “Today’s stiff sentence is a just and fitting end to Sheldon Silver’s long career of corruption,” Bharara said in a statement following the hearing. More than 30 legislators have been forced from office for criminal or ethical issues since 2000, according to the nonprofit watchdog Citizens Union. Prosecutors said Silver awarded $500,000 in secret state grant money to a cancer researcher who, in exchange, funneled patients to Silver’s law firm, allowing the lawmaker to collect millions of dollars in referral fees. He was also accused of steering real estate developers to another law firm in exchange for kickbacks and then throwing his support to rent-control legislation favored by the developers. Silver offered an apology during the hearing, saying: “I’ve let down my family, I’ve let down my colleagues, I’ve let down my constituents, and I am truly, truly sorry for that.” Minutes later, he appeared to have no reaction when Caproni announced the sentence. His lawyers said they plan to appeal his conviction. Steven Molo, one of Silver’s lawyers, had asked Caproni for a “sentence that tempers justice with mercy,” citing Silver’s age, health and what he described as a lifetime of good works for the people of New York. But prosecutors said Silver deserved a sentence longer than that of any other convicted New York public official, given his leadership position and the sheer scope of his misconduct. Caproni agreed, telling Silver that corruption “attacks the very heart of our system of government” before offering a blunt assessment of his behavior. “Mr. Silver, those are not the actions of a basically honest person,” she said after listing some of his crimes. “Those are the actions of a scheming, corrupt politician.”     The judge also ordered Silver to pay a fine of $1.75 million and forfeit more than $5 million in ill-gotten gains. He is scheduled to report to prison on July 1. ",False Negative
